{
  "schema_version": "0.1",
  "package_id": "blocking-open-question",
  "created_at": "2026-05-24",
  "status": "delivery_ready",
  "target_downstream_ai": ["Codex", "Claude Code"],
  "known_facts": [
    "The agent creates Task Execution Pack artifacts for downstream coding agents.",
    "Machine-readable JSON files are the source of truth.",
    "The agent must not execute user business code."
  ],
  "assumptions": [
    "The downstream agent can read local Markdown and JSON files."
  ],
  "open_questions": [],
  "blocking_questions": [
    "Which repository should the downstream coding agent modify?"
  ],
  "artifacts": [
    {
      "path": "package-manifest.json",
      "type": "json",
      "purpose": "Source of truth for package status, facts, artifacts, gates, waivers, and release recommendation."
    },
    {
      "path": "task-brief.md",
      "type": "markdown",
      "purpose": "Human-readable task context, goals, non-goals, assumptions, and success criteria."
    },
    {
      "path": "agile-plan.md",
      "type": "markdown",
      "purpose": "Agile value plan with backlog, user stories, DoR, DoD, review, and retro."
    },
    {
      "path": "execution-manifest.json",
      "type": "json",
      "purpose": "Execution contract for downstream coding agents."
    },
    {
      "path": "tool-contract-matrix.json",
      "type": "json",
      "purpose": "Tool permission, side effect, failure, retry, rollback, and audit contract."
    },
    {
      "path": "eval-plan.json",
      "type": "json",
      "purpose": "Evaluation and release gate cases, including negative cases."
    },
    {
      "path": "role-decision-log.md",
      "type": "markdown",
      "purpose": "Role-owned decision log with challenges, evidence, decisions, impacted artifacts, and regression risks."
    },
    {
      "path": "human-review-report.md",
      "type": "markdown",
      "purpose": "Human review summary for package readiness."
    },
    {
      "path": "governance-report.md",
      "type": "markdown",
      "purpose": "Governance review for schema, fixture, script, test, and release readiness."
    },
    {
      "path": "artifact-index.md",
      "type": "markdown",
      "purpose": "Index of package artifacts and release recommendation."
    }
  ],
  "quality_gates": [
    {
      "name": "required_files",
      "status": "block"
    },
    {
      "name": "release_gate",
      "status": "pass"
    }
  ],
  "human_waivers": [],
  "release_recommendation": "block"
}
